{
  "name": "Suez Canal",
  "type": "canal",
  "region": "Egypt",
  "bounds": [
    {
      "lat": 31.4,
      "lon": 32.2
    },
    {
      "lat": 31.4,
      "lon": 32.7
    },
    {
      "lat": 29.8,
      "lon": 32.7
    },
    {
      "lat": 29.8,
      "lon": 32.2
    }
  ],
  "center": {
    "lat": 30.6,
    "lon": 32.35
  },
  "min_depth_m": 24,
  "min_width_km": 0.2,
  "strategic_value": "critical",
  "carrier_navigable": true,
  "notes": "Artificial canal linking the Mediterranean Sea and Red Sea; carrier transit is possible subject to canal authority restrictions and vessel dimensions.",
  "wikipedia_url": "https://en.wikipedia.org/wiki/Suez_Canal"
}
