{
  "name": "Strait of Otranto",
  "type": "strait",
  "region": "Adriatic / Ionian Sea",
  "bounds": [
    {
      "lat": 41,
      "lon": 18
    },
    {
      "lat": 41,
      "lon": 20
    },
    {
      "lat": 39.3,
      "lon": 20
    },
    {
      "lat": 39.3,
      "lon": 18
    }
  ],
  "center": {
    "lat": 40.2,
    "lon": 19
  },
  "min_depth_m": 700,
  "min_width_km": 72,
  "strategic_value": "medium",
  "carrier_navigable": true,
  "notes": "Entrance to the Adriatic Sea between Italy and Albania.",
  "wikipedia_url": "https://en.wikipedia.org/wiki/Strait_of_Otranto"
}
