{
  "name": "Northwest Passage",
  "type": "sea_lane",
  "region": "Canadian Arctic",
  "bounds": [
    {
      "lat": 76,
      "lon": -130
    },
    {
      "lat": 76,
      "lon": -70
    },
    {
      "lat": 68,
      "lon": -70
    },
    {
      "lat": 68,
      "lon": -130
    }
  ],
  "center": {
    "lat": 72,
    "lon": -100
  },
  "min_depth_m": 10,
  "min_width_km": 20,
  "strategic_value": "medium",
  "carrier_navigable": false,
  "notes": "Arctic routes through the Canadian Arctic Archipelago; ice and shallow channels limit carrier operations.",
  "wikipedia_url": "https://en.wikipedia.org/wiki/Northwest_Passage"
}
