{
  "name": "Øresund",
  "type": "strait",
  "region": "Denmark / Sweden",
  "bounds": [
    [
      {
        "lat": 56.2,
        "lon": 12.546327
      },
      {
        "lat": 56.180333,
        "lon": 12.552131
      },
      {
        "lat": 56.170333,
        "lon": 12.563154
      },
      {
        "lat": 56.121839,
        "lon": 12.600755
      },
      {
        "lat": 56.050122,
        "lon": 12.696506
      },
      {
        "lat": 56.039926,
        "lon": 12.702716
      },
      {
        "lat": 56.020364,
        "lon": 12.706987
      },
      {
        "lat": 56.01063,
        "lon": 12.718196
      },
      {
        "lat": 55.995085,
        "lon": 12.750837
      },
      {
        "lat": 55.982462,
        "lon": 12.758149
      },
      {
        "lat": 55.947368,
        "lon": 12.769069
      },
      {
        "lat": 55.927972,
        "lon": 12.803381
      },
      {
        "lat": 55.901473,
        "lon": 12.808958
      },
      {
        "lat": 55.885309,
        "lon": 12.819867
      },
      {
        "lat": 55.863923,
        "lon": 12.849783
      },
      {
        "lat": 55.85173,
        "lon": 12.890501
      },
      {
        "lat": 55.832709,
        "lon": 12.924342
      },
      {
        "lat": 55.790349,
        "lon": 12.936604
      },
      {
        "lat": 55.778099,
        "lon": 12.934619
      },
      {
        "lat": 55.770984,
        "lon": 12.93046
      },
      {
        "lat": 55.764633,
        "lon": 12.909461
      },
      {
        "lat": 55.748074,
        "lon": 12.921174
      },
      {
        "lat": 55.74335,
        "lon": 12.941071
      },
      {
        "lat": 55.744117,
        "lon": 12.964538
      },
      {
        "lat": 55.724525,
        "lon": 12.973897
      },
      {
        "lat": 55.726293,
        "lon": 13.010732
      },
      {
        "lat": 55.710785,
        "lon": 13.025182
      },
      {
        "lat": 55.69284,
        "lon": 13.053151
      },
      {
        "lat": 55.674385,
        "lon": 13.05929
      },
      {
        "lat": 55.661501,
        "lon": 13.056089
      },
      {
        "lat": 55.636681,
        "lon": 13.036988
      },
      {
        "lat": 55.628399,
        "lon": 13.02634
      },
      {
        "lat": 55.599897,
        "lon": 12.957405
      },
      {
        "lat": 55.579626,
        "lon": 12.9275
      },
      {
        "lat": 55.547161,
        "lon": 12.915491
      },
      {
        "lat": 55.519256,
        "lon": 12.926623
      },
      {
        "lat": 55.473917,
        "lon": 12.974122
      },
      {
        "lat": 55.451882,
        "lon": 12.982116
      },
      {
        "lat": 55.456134,
        "lon": 12.973284
      },
      {
        "lat": 55.455787,
        "lon": 12.961946
      },
      {
        "lat": 55.447854,
        "lon": 12.957972
      },
      {
        "lat": 55.435508,
        "lon": 12.963356
      },
      {
        "lat": 55.426823,
        "lon": 12.951991
      },
      {
        "lat": 55.42076,
        "lon": 12.929403
      },
      {
        "lat": 55.419966,
        "lon": 12.904945
      },
      {
        "lat": 55.426074,
        "lon": 12.887719
      },
      {
        "lat": 55.436258,
        "lon": 12.872561
      },
      {
        "lat": 55.436831,
        "lon": 12.858938
      },
      {
        "lat": 55.4,
        "lon": 12.82679
      },
      {
        "lat": 55.4,
        "lon": 12.373606
      },
      {
        "lat": 55.406424,
        "lon": 12.352355
      },
      {
        "lat": 55.408548,
        "lon": 12.3
      },
      {
        "lat": 55.57452,
        "lon": 12.3
      },
      {
        "lat": 55.593573,
        "lon": 12.332142
      },
      {
        "lat": 55.617202,
        "lon": 12.403878
      },
      {
        "lat": 55.616848,
        "lon": 12.423329
      },
      {
        "lat": 55.606974,
        "lon": 12.44795
      },
      {
        "lat": 55.603547,
        "lon": 12.464813
      },
      {
        "lat": 55.608001,
        "lon": 12.487918
      },
      {
        "lat": 55.632428,
        "lon": 12.504685
      },
      {
        "lat": 55.647278,
        "lon": 12.542236
      },
      {
        "lat": 55.691569,
        "lon": 12.582575
      },
      {
        "lat": 55.707702,
        "lon": 12.604029
      },
      {
        "lat": 55.729169,
        "lon": 12.589947
      },
      {
        "lat": 55.75254,
        "lon": 12.596684
      },
      {
        "lat": 55.787021,
        "lon": 12.599928
      },
      {
        "lat": 55.798125,
        "lon": 12.604068
      },
      {
        "lat": 55.810776,
        "lon": 12.591223
      },
      {
        "lat": 55.830189,
        "lon": 12.577746
      },
      {
        "lat": 55.85183,
        "lon": 12.567006
      },
      {
        "lat": 55.884079,
        "lon": 12.556055
      },
      {
        "lat": 55.899808,
        "lon": 12.541561
      },
      {
        "lat": 55.921791,
        "lon": 12.514706
      },
      {
        "lat": 55.927401,
        "lon": 12.514706
      },
      {
        "lat": 55.938571,
        "lon": 12.52707
      },
      {
        "lat": 55.995104,
        "lon": 12.568771
      },
      {
        "lat": 56.026569,
        "lon": 12.609784
      },
      {
        "lat": 56.043705,
        "lon": 12.623917
      },
      {
        "lat": 56.070072,
        "lon": 12.570933
      },
      {
        "lat": 56.077275,
        "lon": 12.541071
      },
      {
        "lat": 56.095022,
        "lon": 12.506128
      },
      {
        "lat": 56.100939,
        "lon": 12.486676
      },
      {
        "lat": 56.101026,
        "lon": 12.415201
      },
      {
        "lat": 56.128852,
        "lon": 12.328888
      },
      {
        "lat": 56.129524,
        "lon": 12.3
      },
      {
        "lat": 56.2,
        "lon": 12.3
      }
    ],
    [
      {
        "lat": 55.619299,
        "lon": 12.788402
      },
      {
        "lat": 55.622851,
        "lon": 12.788774
      },
      {
        "lat": 55.628374,
        "lon": 12.784005
      },
      {
        "lat": 55.647752,
        "lon": 12.78431
      },
      {
        "lat": 55.66235,
        "lon": 12.780983
      },
      {
        "lat": 55.670014,
        "lon": 12.77256
      },
      {
        "lat": 55.673162,
        "lon": 12.762227
      },
      {
        "lat": 55.670872,
        "lon": 12.751945
      },
      {
        "lat": 55.663698,
        "lon": 12.742195
      },
      {
        "lat": 55.635702,
        "lon": 12.732469
      },
      {
        "lat": 55.622668,
        "lon": 12.742257
      },
      {
        "lat": 55.613873,
        "lon": 12.758098
      },
      {
        "lat": 55.609196,
        "lon": 12.759964
      },
      {
        "lat": 55.605371,
        "lon": 12.766578
      },
      {
        "lat": 55.608093,
        "lon": 12.774601
      }
    ],
    [
      {
        "lat": 55.900361,
        "lon": 12.725683
      },
      {
        "lat": 55.911124,
        "lon": 12.723047
      },
      {
        "lat": 55.920214,
        "lon": 12.703973
      },
      {
        "lat": 55.923125,
        "lon": 12.686743
      },
      {
        "lat": 55.921197,
        "lon": 12.673192
      },
      {
        "lat": 55.913268,
        "lon": 12.669609
      },
      {
        "lat": 55.887414,
        "lon": 12.702631
      },
      {
        "lat": 55.890073,
        "lon": 12.714912
      }
    ],
    [
      {
        "lat": 55.605874,
        "lon": 12.67581
      },
      {
        "lat": 55.703113,
        "lon": 12.608542
      },
      {
        "lat": 55.692657,
        "lon": 12.593547
      },
      {
        "lat": 55.655512,
        "lon": 12.566058
      },
      {
        "lat": 55.633466,
        "lon": 12.529768
      },
      {
        "lat": 55.619385,
        "lon": 12.518201
      },
      {
        "lat": 55.596166,
        "lon": 12.518605
      },
      {
        "lat": 55.568396,
        "lon": 12.533069
      },
      {
        "lat": 55.5485,
        "lon": 12.556063
      },
      {
        "lat": 55.552095,
        "lon": 12.578505
      },
      {
        "lat": 55.567425,
        "lon": 12.606477
      },
      {
        "lat": 55.576497,
        "lon": 12.640334
      },
      {
        "lat": 55.599703,
        "lon": 12.675822
      }
    ]
  ],
  "center": {
    "lat": 55.804451,
    "lon": 12.765084
  },
  "min_depth_m": 8,
  "min_width_km": 4,
  "strategic_value": "medium",
  "carrier_navigable": false,
  "notes": "Danish strait between Zealand and Sweden; shallow depth limits large carrier transit.",
  "wikipedia_url": "https://en.wikipedia.org/wiki/%C3%98resund"
}
