{
  "name": "Bering Strait",
  "type": "strait",
  "region": "Arctic / North Pacific",
  "bounds": [
    [
      {
        "lat": 66.5,
        "lon": -168.0
      },
      {
        "lat": 65.731583,
        "lon": -168.0
      },
      {
        "lat": 65.710477,
        "lon": -168.073232
      },
      {
        "lat": 65.689182,
        "lon": -168.11738
      },
      {
        "lat": 65.6759,
        "lon": -168.128791
      },
      {
        "lat": 65.672439,
        "lon": -168.137568
      },
      {
        "lat": 65.664991,
        "lon": -168.14119
      },
      {
        "lat": 65.639997,
        "lon": -168.130862
      },
      {
        "lat": 65.621628,
        "lon": -168.106832
      },
      {
        "lat": 65.593679,
        "lon": -168.092437
      },
      {
        "lat": 65.569866,
        "lon": -168.033335
      },
      {
        "lat": 65.5639,
        "lon": -168.0
      },
      {
        "lat": 65.3,
        "lon": -168.0
      },
      {
        "lat": 65.3,
        "lon": -170.5
      },
      {
        "lat": 65.65549,
        "lon": -170.5
      },
      {
        "lat": 65.670633,
        "lon": -170.485025
      },
      {
        "lat": 65.676914,
        "lon": -170.5
      },
      {
        "lat": 65.870238,
        "lon": -170.5
      },
      {
        "lat": 65.903951,
        "lon": -170.425498
      },
      {
        "lat": 65.932889,
        "lon": -170.340234
      },
      {
        "lat": 65.951687,
        "lon": -170.235179
      },
      {
        "lat": 66.000253,
        "lon": -170.141781
      },
      {
        "lat": 66.035277,
        "lon": -169.980985
      },
      {
        "lat": 66.039045,
        "lon": -169.892731
      },
      {
        "lat": 66.018954,
        "lon": -169.868421
      },
      {
        "lat": 66.000745,
        "lon": -169.825693
      },
      {
        "lat": 66.002401,
        "lon": -169.718245
      },
      {
        "lat": 66.019108,
        "lon": -169.692786
      },
      {
        "lat": 66.068146,
        "lon": -169.637639
      },
      {
        "lat": 66.088097,
        "lon": -169.651997
      },
      {
        "lat": 66.116902,
        "lon": -169.696129
      },
      {
        "lat": 66.130404,
        "lon": -169.697604
      },
      {
        "lat": 66.13467,
        "lon": -169.706121
      },
      {
        "lat": 66.16089,
        "lon": -169.811108
      },
      {
        "lat": 66.173299,
        "lon": -169.90592
      },
      {
        "lat": 66.187484,
        "lon": -169.951492
      },
      {
        "lat": 66.193874,
        "lon": -169.99069
      },
      {
        "lat": 66.197052,
        "lon": -170.043712
      },
      {
        "lat": 66.193514,
        "lon": -170.047313
      },
      {
        "lat": 66.18967,
        "lon": -170.044491
      },
      {
        "lat": 66.167965,
        "lon": -169.93378
      },
      {
        "lat": 66.162212,
        "lon": -169.9214
      },
      {
        "lat": 66.153552,
        "lon": -169.92532
      },
      {
        "lat": 66.148606,
        "lon": -169.947729
      },
      {
        "lat": 66.149428,
        "lon": -169.974239
      },
      {
        "lat": 66.173424,
        "lon": -170.043792
      },
      {
        "lat": 66.173039,
        "lon": -170.085877
      },
      {
        "lat": 66.151843,
        "lon": -170.115997
      },
      {
        "lat": 66.143072,
        "lon": -170.13684
      },
      {
        "lat": 66.151828,
        "lon": -170.222798
      },
      {
        "lat": 66.177597,
        "lon": -170.301387
      },
      {
        "lat": 66.175358,
        "lon": -170.260058
      },
      {
        "lat": 66.181849,
        "lon": -170.234932
      },
      {
        "lat": 66.170496,
        "lon": -170.203491
      },
      {
        "lat": 66.176742,
        "lon": -170.128304
      },
      {
        "lat": 66.192305,
        "lon": -170.102529
      },
      {
        "lat": 66.226162,
        "lon": -170.138818
      },
      {
        "lat": 66.252174,
        "lon": -170.151823
      },
      {
        "lat": 66.279097,
        "lon": -170.21382
      },
      {
        "lat": 66.294108,
        "lon": -170.273672
      },
      {
        "lat": 66.296229,
        "lon": -170.352184
      },
      {
        "lat": 66.288891,
        "lon": -170.391054
      },
      {
        "lat": 66.262302,
        "lon": -170.461972
      },
      {
        "lat": 66.238386,
        "lon": -170.5
      },
      {
        "lat": 66.284426,
        "lon": -170.5
      },
      {
        "lat": 66.2906,
        "lon": -170.482565
      },
      {
        "lat": 66.303439,
        "lon": -170.402277
      },
      {
        "lat": 66.316434,
        "lon": -170.381444
      },
      {
        "lat": 66.320169,
        "lon": -170.38428
      },
      {
        "lat": 66.348546,
        "lon": -170.5
      },
      {
        "lat": 66.5,
        "lon": -170.5
      }
    ],
    [
      {
        "lat": 65.762376,
        "lon": -168.899125
      },
      {
        "lat": 65.771697,
        "lon": -168.906326
      },
      {
        "lat": 65.772556,
        "lon": -168.920784
      },
      {
        "lat": 65.767911,
        "lon": -168.944946
      },
      {
        "lat": 65.752352,
        "lon": -168.955393
      },
      {
        "lat": 65.740167,
        "lon": -168.943329
      },
      {
        "lat": 65.735877,
        "lon": -168.909204
      },
      {
        "lat": 65.746374,
        "lon": -168.896072
      }
    ],
    [
      {
        "lat": 65.83194,
        "lon": -169.063076
      },
      {
        "lat": 65.818085,
        "lon": -169.086384
      },
      {
        "lat": 65.800281,
        "lon": -169.096918
      },
      {
        "lat": 65.779373,
        "lon": -169.10181
      },
      {
        "lat": 65.759471,
        "lon": -169.096513
      },
      {
        "lat": 65.751386,
        "lon": -169.077214
      },
      {
        "lat": 65.754425,
        "lon": -169.049922
      },
      {
        "lat": 65.7708,
        "lon": -169.025444
      },
      {
        "lat": 65.815205,
        "lon": -168.990927
      },
      {
        "lat": 65.819397,
        "lon": -168.993363
      },
      {
        "lat": 65.83098,
        "lon": -169.040436
      }
    ]
  ],
  "center": {
    "lat": 65.887094,
    "lon": -169.231375
  },
  "min_depth_m": 30,
  "min_width_km": 82,
  "strategic_value": "high",
  "carrier_navigable": true,
  "notes": "Only marine passage between the Pacific and Arctic oceans; seasonal ice and shallow depths constrain operations.",
  "wikipedia_url": "https://en.wikipedia.org/wiki/Bering_Strait"
}
