{
  "name": "Lombok Strait",
  "type": "strait",
  "region": "Indonesia",
  "bounds": [
    [
      {
        "lat": -8.1,
        "lon": 116.2
      },
      {
        "lat": -8.315112,
        "lon": 116.2
      },
      {
        "lat": -8.345251,
        "lon": 116.166894
      },
      {
        "lat": -8.372958,
        "lon": 116.121475
      },
      {
        "lat": -8.403783,
        "lon": 116.104487
      },
      {
        "lat": -8.406432,
        "lon": 116.097614
      },
      {
        "lat": -8.404251,
        "lon": 116.068849
      },
      {
        "lat": -8.412904,
        "lon": 116.049052
      },
      {
        "lat": -8.444572,
        "lon": 116.025985
      },
      {
        "lat": -8.501149,
        "lon": 116.036736
      },
      {
        "lat": -8.52235,
        "lon": 116.061144
      },
      {
        "lat": -8.577921,
        "lon": 116.070639
      },
      {
        "lat": -8.638253,
        "lon": 116.06868
      },
      {
        "lat": -8.672909,
        "lon": 116.061354
      },
      {
        "lat": -8.71433,
        "lon": 116.058316
      },
      {
        "lat": -8.72808,
        "lon": 116.088924
      },
      {
        "lat": -8.735862,
        "lon": 116.085959
      },
      {
        "lat": -8.741728,
        "lon": 116.075924
      },
      {
        "lat": -8.756651,
        "lon": 116.065537
      },
      {
        "lat": -8.733071,
        "lon": 116.051977
      },
      {
        "lat": -8.732146,
        "lon": 116.041259
      },
      {
        "lat": -8.746037,
        "lon": 116.022689
      },
      {
        "lat": -8.740385,
        "lon": 115.99355
      },
      {
        "lat": -8.735059,
        "lon": 115.983003
      },
      {
        "lat": -8.751759,
        "lon": 115.953929
      },
      {
        "lat": -8.752765,
        "lon": 115.893439
      },
      {
        "lat": -8.723142,
        "lon": 115.880544
      },
      {
        "lat": -8.728493,
        "lon": 115.86866
      },
      {
        "lat": -8.722841,
        "lon": 115.848155
      },
      {
        "lat": -8.748189,
        "lon": 115.831942
      },
      {
        "lat": -8.791796,
        "lon": 115.826638
      },
      {
        "lat": -8.818551,
        "lon": 115.838199
      },
      {
        "lat": -8.823144,
        "lon": 115.866784
      },
      {
        "lat": -8.856755,
        "lon": 115.927453
      },
      {
        "lat": -8.859995,
        "lon": 115.944552
      },
      {
        "lat": -8.856985,
        "lon": 115.959346
      },
      {
        "lat": -8.851497,
        "lon": 115.968789
      },
      {
        "lat": -8.859461,
        "lon": 115.980209
      },
      {
        "lat": -8.868234,
        "lon": 115.98675
      },
      {
        "lat": -8.900207,
        "lon": 116.00065
      },
      {
        "lat": -8.910064,
        "lon": 116.018766
      },
      {
        "lat": -8.910041,
        "lon": 116.030568
      },
      {
        "lat": -8.903212,
        "lon": 116.042061
      },
      {
        "lat": -8.871122,
        "lon": 116.038181
      },
      {
        "lat": -8.866479,
        "lon": 116.041469
      },
      {
        "lat": -8.857799,
        "lon": 116.06866
      },
      {
        "lat": -8.859792,
        "lon": 116.076703
      },
      {
        "lat": -8.865599,
        "lon": 116.081632
      },
      {
        "lat": -8.871762,
        "lon": 116.080659
      },
      {
        "lat": -8.884343,
        "lon": 116.062255
      },
      {
        "lat": -8.896589,
        "lon": 116.076772
      },
      {
        "lat": -8.897601,
        "lon": 116.091766
      },
      {
        "lat": -8.890051,
        "lon": 116.102985
      },
      {
        "lat": -8.87672,
        "lon": 116.10719
      },
      {
        "lat": -8.877661,
        "lon": 116.152144
      },
      {
        "lat": -8.880381,
        "lon": 116.166368
      },
      {
        "lat": -8.88915,
        "lon": 116.176983
      },
      {
        "lat": -8.915592,
        "lon": 116.194919
      },
      {
        "lat": -8.919174,
        "lon": 116.2
      },
      {
        "lat": -9.0,
        "lon": 116.2
      },
      {
        "lat": -9.0,
        "lon": 115.4
      },
      {
        "lat": -8.586116,
        "lon": 115.4
      },
      {
        "lat": -8.550116,
        "lon": 115.499874
      },
      {
        "lat": -8.535468,
        "lon": 115.517624
      },
      {
        "lat": -8.51278,
        "lon": 115.524608
      },
      {
        "lat": -8.508492,
        "lon": 115.534201
      },
      {
        "lat": -8.502745,
        "lon": 115.605924
      },
      {
        "lat": -8.467823,
        "lon": 115.641163
      },
      {
        "lat": -8.457055,
        "lon": 115.659715
      },
      {
        "lat": -8.420385,
        "lon": 115.702489
      },
      {
        "lat": -8.3752,
        "lon": 115.716203
      },
      {
        "lat": -8.34289,
        "lon": 115.692385
      },
      {
        "lat": -8.316871,
        "lon": 115.653746
      },
      {
        "lat": -8.287368,
        "lon": 115.620605
      },
      {
        "lat": -8.22024,
        "lon": 115.56657
      },
      {
        "lat": -8.193018,
        "lon": 115.53656
      },
      {
        "lat": -8.170859,
        "lon": 115.503398
      },
      {
        "lat": -8.127588,
        "lon": 115.4
      },
      {
        "lat": -8.1,
        "lon": 115.4
      }
    ],
    [
      {
        "lat": -8.343173,
        "lon": 116.033696
      },
      {
        "lat": -8.355815,
        "lon": 116.027472
      },
      {
        "lat": -8.363504,
        "lon": 116.033838
      },
      {
        "lat": -8.354653,
        "lon": 116.04449
      },
      {
        "lat": -8.345182,
        "lon": 116.043398
      }
    ],
    [
      {
        "lat": -8.670848,
        "lon": 115.574745
      },
      {
        "lat": -8.664194,
        "lon": 115.55023
      },
      {
        "lat": -8.671583,
        "lon": 115.534778
      },
      {
        "lat": -8.66842,
        "lon": 115.516638
      },
      {
        "lat": -8.677724,
        "lon": 115.505444
      },
      {
        "lat": -8.722565,
        "lon": 115.469799
      },
      {
        "lat": -8.732131,
        "lon": 115.46629
      },
      {
        "lat": -8.738379,
        "lon": 115.473733
      },
      {
        "lat": -8.742405,
        "lon": 115.487628
      },
      {
        "lat": -8.762453,
        "lon": 115.504099
      },
      {
        "lat": -8.800653,
        "lon": 115.559669
      },
      {
        "lat": -8.809297,
        "lon": 115.589064
      },
      {
        "lat": -8.76873,
        "lon": 115.626196
      },
      {
        "lat": -8.738675,
        "lon": 115.61749
      },
      {
        "lat": -8.717693,
        "lon": 115.599495
      },
      {
        "lat": -8.694749,
        "lon": 115.590931
      }
    ]
  ],
  "center": {
    "lat": -8.542792,
    "lon": 115.786693
  },
  "min_depth_m": 250,
  "min_width_km": 18,
  "strategic_value": "high",
  "carrier_navigable": true,
  "notes": "Deep alternative to Malacca/Sunda routes between Bali and Lombok, suitable for deep-draught warships.",
  "wikipedia_url": "https://en.wikipedia.org/wiki/Lombok_Strait"
}
