{
  "name": "Dover Strait",
  "type": "strait",
  "region": "Western Europe",
  "bounds": [
    {
      "lat": 51.3,
      "lon": 0.8
    },
    {
      "lat": 51.3,
      "lon": 1.9
    },
    {
      "lat": 50.8,
      "lon": 1.9
    },
    {
      "lat": 50.8,
      "lon": 0.8
    }
  ],
  "center": {
    "lat": 51.05,
    "lon": 1.35
  },
  "min_depth_m": 30,
  "min_width_km": 33,
  "strategic_value": "high",
  "carrier_navigable": true,
  "notes": "Narrowest part of the English Channel and one of the world’s busiest shipping lanes.",
  "wikipedia_url": "https://en.wikipedia.org/wiki/Strait_of_Dover"
}
