{
  "name": "Strait of Sicily",
  "type": "strait",
  "region": "Central Mediterranean",
  "bounds": [
    {
      "lat": 38.5,
      "lon": 10
    },
    {
      "lat": 38.5,
      "lon": 15.5
    },
    {
      "lat": 35,
      "lon": 15.5
    },
    {
      "lat": 35,
      "lon": 10
    }
  ],
  "center": {
    "lat": 36.8,
    "lon": 12.8
  },
  "min_depth_m": 300,
  "min_width_km": 145,
  "strategic_value": "high",
  "carrier_navigable": true,
  "notes": "Central Mediterranean passage between Sicily and Tunisia.",
  "wikipedia_url": "https://en.wikipedia.org/wiki/Strait_of_Sicily"
}
