{
  "name": "Panama Canal",
  "bounds": [
    {
      "lat": 9.390129165117468,
      "lon": -80.01548767089845
    },
    {
      "lat": 9.390129165117468,
      "lon": -79.45
    },
    {
      "lat": 8.85,
      "lon": -79.45
    },
    {
      "lat": 8.85,
      "lon": -80.01548767089845
    }
  ],
  "notes": "Artificial canal linking Atlantic and Pacific; locks constrain beam and length, excluding large fleet carriers.",
  "wikipedia_url": "https://en.wikipedia.org/wiki/Panama_Canal",
  "type": "canal",
  "region": "Panama",
  "center": {
    "lat": 9.120064582558733,
    "lon": -79.73274383544923
  },
  "min_depth_m": 15.2,
  "min_width_km": 0.055,
  "strategic_value": "critical",
  "carrier_navigable": false
}
