{
  "name": "Dardanelles",
  "type": "strait",
  "region": "Turkey",
  "bounds": [
    {
      "lat": 40.5,
      "lon": 26.561019
    },
    {
      "lat": 40.487173,
      "lon": 26.534803
    },
    {
      "lat": 40.45837,
      "lon": 26.49087
    },
    {
      "lat": 40.441629,
      "lon": 26.431884
    },
    {
      "lat": 40.411602,
      "lon": 26.384769
    },
    {
      "lat": 40.387023,
      "lon": 26.335059
    },
    {
      "lat": 40.367155,
      "lon": 26.320113
    },
    {
      "lat": 40.366652,
      "lon": 26.301045
    },
    {
      "lat": 40.35136,
      "lon": 26.249403
    },
    {
      "lat": 40.33312,
      "lon": 26.21799
    },
    {
      "lat": 40.323309,
      "lon": 26.208527
    },
    {
      "lat": 40.31568,
      "lon": 26.213621
    },
    {
      "lat": 40.313477,
      "lon": 26.226337
    },
    {
      "lat": 40.309832,
      "lon": 26.229413
    },
    {
      "lat": 40.30484,
      "lon": 26.226977
    },
    {
      "lat": 40.298173,
      "lon": 26.2166
    },
    {
      "lat": 40.295509,
      "lon": 26.216636
    },
    {
      "lat": 40.277559,
      "lon": 26.246607
    },
    {
      "lat": 40.256845,
      "lon": 26.265072
    },
    {
      "lat": 40.230564,
      "lon": 26.269922
    },
    {
      "lat": 40.195534,
      "lon": 26.25802
    },
    {
      "lat": 40.147245,
      "lon": 26.213078
    },
    {
      "lat": 40.095663,
      "lon": 26.188697
    },
    {
      "lat": 40.080465,
      "lon": 26.166456
    },
    {
      "lat": 40.067982,
      "lon": 26.158161
    },
    {
      "lat": 40.053813,
      "lon": 26.156172
    },
    {
      "lat": 40.04792,
      "lon": 26.166567
    },
    {
      "lat": 40.048733,
      "lon": 26.177743
    },
    {
      "lat": 40.063084,
      "lon": 26.231508
    },
    {
      "lat": 40.069068,
      "lon": 26.243953
    },
    {
      "lat": 40.09085,
      "lon": 26.27412
    },
    {
      "lat": 40.116989,
      "lon": 26.328975
    },
    {
      "lat": 40.151892,
      "lon": 26.377001
    },
    {
      "lat": 40.154966,
      "lon": 26.377195
    },
    {
      "lat": 40.164051,
      "lon": 26.362764
    },
    {
      "lat": 40.182104,
      "lon": 26.350703
    },
    {
      "lat": 40.198785,
      "lon": 26.347757
    },
    {
      "lat": 40.206241,
      "lon": 26.359846
    },
    {
      "lat": 40.209437,
      "lon": 26.380539
    },
    {
      "lat": 40.228596,
      "lon": 26.427585
    },
    {
      "lat": 40.240176,
      "lon": 26.446029
    },
    {
      "lat": 40.268124,
      "lon": 26.477192
    },
    {
      "lat": 40.27236,
      "lon": 26.478023
    },
    {
      "lat": 40.288303,
      "lon": 26.498392
    },
    {
      "lat": 40.296268,
      "lon": 26.511167
    },
    {
      "lat": 40.301946,
      "lon": 26.540691
    },
    {
      "lat": 40.344501,
      "lon": 26.602724
    },
    {
      "lat": 40.358634,
      "lon": 26.618501
    },
    {
      "lat": 40.375162,
      "lon": 26.624816
    },
    {
      "lat": 40.39163,
      "lon": 26.626762
    },
    {
      "lat": 40.398383,
      "lon": 26.632717
    },
    {
      "lat": 40.411888,
      "lon": 26.664926
    },
    {
      "lat": 40.424542,
      "lon": 26.675968
    },
    {
      "lat": 40.45409,
      "lon": 26.685031
    },
    {
      "lat": 40.463966,
      "lon": 26.709296
    },
    {
      "lat": 40.485706,
      "lon": 26.741718
    },
    {
      "lat": 40.49421,
      "lon": 26.759999
    },
    {
      "lat": 40.498728,
      "lon": 26.8
    },
    {
      "lat": 40.405993,
      "lon": 26.8
    },
    {
      "lat": 40.407501,
      "lon": 26.776608
    },
    {
      "lat": 40.40535,
      "lon": 26.734734
    },
    {
      "lat": 40.392071,
      "lon": 26.713243
    },
    {
      "lat": 40.292028,
      "lon": 26.606373
    },
    {
      "lat": 40.284406,
      "lon": 26.594067
    },
    {
      "lat": 40.27172,
      "lon": 26.562389
    },
    {
      "lat": 40.226721,
      "lon": 26.518104
    },
    {
      "lat": 40.214838,
      "lon": 26.499963
    },
    {
      "lat": 40.207958,
      "lon": 26.46713
    },
    {
      "lat": 40.198548,
      "lon": 26.440922
    },
    {
      "lat": 40.195226,
      "lon": 26.406712
    },
    {
      "lat": 40.17303,
      "lon": 26.394351
    },
    {
      "lat": 40.157451,
      "lon": 26.401016
    },
    {
      "lat": 40.139171,
      "lon": 26.401488
    },
    {
      "lat": 40.121506,
      "lon": 26.397686
    },
    {
      "lat": 40.107049,
      "lon": 26.388194
    },
    {
      "lat": 40.106455,
      "lon": 26.37251
    },
    {
      "lat": 40.103998,
      "lon": 26.367703
    },
    {
      "lat": 40.0947,
      "lon": 26.368335
    },
    {
      "lat": 40.085013,
      "lon": 26.36426
    },
    {
      "lat": 40.072188,
      "lon": 26.363032
    },
    {
      "lat": 40.064435,
      "lon": 26.360372
    },
    {
      "lat": 40.053583,
      "lon": 26.351783
    },
    {
      "lat": 40.021191,
      "lon": 26.309993
    },
    {
      "lat": 39.996989,
      "lon": 26.250911
    },
    {
      "lat": 40.010854,
      "lon": 26.19787
    },
    {
      "lat": 40.003356,
      "lon": 26.187423
    },
    {
      "lat": 39.974592,
      "lon": 26.16593
    },
    {
      "lat": 39.95701,
      "lon": 26.159767
    },
    {
      "lat": 39.943195,
      "lon": 26.150685
    },
    {
      "lat": 39.933998,
      "lon": 26.147924
    },
    {
      "lat": 39.924548,
      "lon": 26.148652
    },
    {
      "lat": 39.9,
      "lon": 26.154614
    },
    {
      "lat": 39.9,
      "lon": 26.0
    },
    {
      "lat": 40.138806,
      "lon": 26.0
    },
    {
      "lat": 40.146064,
      "lon": 26.014218
    },
    {
      "lat": 40.167682,
      "lon": 26.013881
    },
    {
      "lat": 40.168538,
      "lon": 26.005506
    },
    {
      "lat": 40.165324,
      "lon": 26.0
    },
    {
      "lat": 40.5,
      "lon": 26.0
    }
  ],
  "center": {
    "lat": 40.202513,
    "lon": 26.130196
  },
  "min_depth_m": 55,
  "min_width_km": 1.2,
  "strategic_value": "high",
  "carrier_navigable": false,
  "notes": "Strait connecting the Aegean Sea and Sea of Marmara.",
  "wikipedia_url": "https://en.wikipedia.org/wiki/Dardanelles"
}
