{
  "name": "GIUK Gap",
  "type": "chokepoint",
  "region": "North Atlantic",
  "bounds": [
    {
      "lat": 66,
      "lon": -45
    },
    {
      "lat": 66,
      "lon": -5
    },
    {
      "lat": 55,
      "lon": -5
    },
    {
      "lat": 55,
      "lon": -45
    }
  ],
  "center": {
    "lat": 61,
    "lon": -25
  },
  "min_depth_m": 500,
  "min_width_km": 300,
  "strategic_value": "high",
  "carrier_navigable": true,
  "notes": "Strategic North Atlantic naval passage between Greenland, Iceland, and the United Kingdom.",
  "wikipedia_url": "https://en.wikipedia.org/wiki/GIUK_gap"
}
