{
  "name": "Great Belt",
  "type": "strait",
  "region": "Denmark",
  "bounds": [
    {
      "lat": 56.2,
      "lon": 10.5
    },
    {
      "lat": 56.2,
      "lon": 11.6
    },
    {
      "lat": 54.8,
      "lon": 11.6
    },
    {
      "lat": 54.8,
      "lon": 10.5
    }
  ],
  "center": {
    "lat": 55.5,
    "lon": 11
  },
  "min_depth_m": 15,
  "min_width_km": 16,
  "strategic_value": "medium",
  "carrier_navigable": true,
  "notes": "Primary deep-water Danish strait between the Kattegat and Baltic Sea.",
  "wikipedia_url": "https://en.wikipedia.org/wiki/Great_Belt"
}
