{
  "name": "Torres Strait",
  "type": "strait",
  "region": "Australia / Papua New Guinea",
  "bounds": [
    {
      "lat": -9,
      "lon": 141.5
    },
    {
      "lat": -9,
      "lon": 144.5
    },
    {
      "lat": -11,
      "lon": 144.5
    },
    {
      "lat": -11,
      "lon": 141.5
    }
  ],
  "center": {
    "lat": -10,
    "lon": 143
  },
  "min_depth_m": 7,
  "min_width_km": 150,
  "strategic_value": "medium",
  "carrier_navigable": false,
  "notes": "Shallow reef-filled passage between Australia and New Guinea; unsuitable for large aircraft carriers.",
  "wikipedia_url": "https://en.wikipedia.org/wiki/Torres_Strait"
}
