{
  "name": "La Pérouse Strait",
  "type": "strait",
  "region": "Russia / Japan",
  "bounds": [
    {
      "lat": 46.5,
      "lon": 141
    },
    {
      "lat": 46.5,
      "lon": 143.5
    },
    {
      "lat": 45.5,
      "lon": 143.5
    },
    {
      "lat": 45.5,
      "lon": 141
    }
  ],
  "center": {
    "lat": 46,
    "lon": 142.2
  },
  "min_depth_m": 50,
  "min_width_km": 43,
  "strategic_value": "medium",
  "carrier_navigable": true,
  "notes": "Passage between Hokkaido and Sakhalin.",
  "wikipedia_url": "https://en.wikipedia.org/wiki/La_P%C3%A9rouse_Strait"
}
